Tipo de Propiedad,Ubicación,Área (m²),Precio,Moneda,Condición,Tipo de Pago,Año de Construcción,Número de Habitaciones,Número de Baños,Número de Estacionamientos,Descripción
Oficina,Trujillo,234.12,289264.74,$,En construcción,Alquiler,2016,5,3,1,Reduce speech standard shoulder share. Back song campaign yes visit skill help.
Casa,Tacna,171.43,422713.9,S/,En construcción,Venta,2019,5,4,1,Among rate her risk.
Local Comercial,Pucallpa,167.04,374308.68,$,Estreno,Alquiler,2000,1,4,2,Throw far article receive agent summer. Live figure director. Art learn clear long race.
Oficina,Pucallpa,121.24,432601.67,S/,Estreno,Alquiler,2023,1,1,1,Peace chair few result first dinner.
Casa,Trujillo,285.15,69063.1,$,Estreno,Alquiler,2014,2,2,3,"They board today not.
Fear couple son field."
Departamento,Piura,147.78,497227.41,S/,Usado,Alquiler,2007,5,3,2,People animal have culture lay view. Base wear affect way significant with medical.
Local Comercial,Tacna,101.59,97115.81,S/,Usado,Alquiler,2007,5,1,0,Machine effort bad recent play check.
Local Comercial,Chiclayo,62.7,437791.55,S/,Usado,Alquiler,2009,5,1,3,Sort or health rather. Key finally check toward item.
Departamento,Ica,66.01,449800.23,S/,En construcción,Venta,2005,5,3,0,Last cold yourself relate budget rather life single.
Oficina,Pucallpa,146.82,81695.35,S/,Usado,Alquiler,2013,1,2,1,Drive local heavy arrive. Consumer drug stay. Notice pressure nice culture truth loss they.
Local Comercial,Pucallpa,252.05,226750.35,$,En construcción,Alquiler,2024,4,1,2,Force author condition method argue. Could detail public bit. Down model house away large.
Oficina,Arequipa,209.65,434742.3,S/,En construcción,Venta,2006,3,2,1,Both condition recent generation up happen manage.
Casa,Arequipa,32.53,376621.89,$,En construcción,Venta,2004,5,4,2,Price smile money compare store age agency run. Letter realize thousand major same.
Casa,Cusco,156.09,113240.55,$,Estreno,Alquiler,2002,1,2,2,Structure support investment. Official three simply increase important ten senior.
Local Comercial,Pucallpa,211.85,350431.72,S/,Usado,Venta,2019,4,2,0,Table story product girl. Physical political and wife view success Democrat.
Departamento,Lima,196.3,426438.01,S/,En construcción,Venta,2002,2,3,3,Anyone ready car fire either. May system break big.
Local Comercial,Ica,182.07,468483.95,$,En construcción,Venta,2022,5,1,2,And reason risk write song four. Hard certain hotel wall recognize seat. House member since these.
Oficina,Arequipa,240.03,185826.02,S/,Usado,Venta,2001,4,1,1,Step health many fall ask enter speech.
Oficina,Arequipa,213.89,248478.08,S/,En construcción,Venta,2019,3,2,1,Because choice should firm thank serious learn sense. Rate level task lead in computer.
Oficina,Trujillo,277.78,252907.45,S/,En construcción,Alquiler,2024,5,3,1,Free look recent. Because exactly southern grow hot sit.
Local Comercial,Lima,98.74,399535.93,$,Estreno,Alquiler,2018,4,2,3,Or action four heart. Order data thank suddenly.
Casa,Cusco,276.42,122406.48,S/,Usado,Alquiler,2000,1,1,3,Plan ground something career claim big. Wait push table yes million day speech even.
Casa,Pucallpa,104.26,267237.5,$,En construcción,Venta,2011,5,4,2,Drop after region far lay. Employee morning half never back. Fear put religious machine.
Departamento,Ica,161.68,207446.59,$,En construcción,Venta,2016,4,1,2,Sit audience central item. System in let me attention. Player hand build.
Departamento,Trujillo,219.3,164975.33,$,Usado,Venta,2014,2,1,2,Really which imagine maintain fund rate need fact. Report inside grow growth kid movement.
Departamento,Trujillo,141.32,469091.7,S/,En construcción,Alquiler,2024,4,3,2,Today enjoy financial suggest indicate. One position man material report.
Local Comercial,Trujillo,82.1,220298.43,S/,Estreno,Venta,2023,5,1,1,Lot another fact particular happy where reduce. Glass ready safe easy about.
Oficina,Chiclayo,105.94,472679.71,$,En construcción,Alquiler,2023,2,1,1,"Involve experience raise son such.
Buy degree accept available effort purpose important."
Oficina,Arequipa,163.22,101787.76,$,Usado,Venta,2016,2,1,0,Respond only exactly hear let lead focus. Rich approach level hotel. Different yard control.
Departamento,Cusco,266.2,455491.67,S/,Usado,Alquiler,2005,2,3,3,Candidate baby teacher. Sell plant few like argue scene know Congress.
Departamento,Chiclayo,188.28,209292.95,$,En construcción,Alquiler,2017,5,2,3,Store hard society wish show upon draw low.
Departamento,Pucallpa,86.02,97194.3,S/,En construcción,Venta,2003,3,3,3,Option else film discuss outside born change. Top both the require hour goal.
Departamento,Juliaca,134.23,229691.24,S/,Usado,Venta,2001,3,2,1,Science fund play every success. Respond rise specific his. Fire three arm blood east.
Casa,Ica,126.38,242430.69,$,Usado,Alquiler,2024,4,2,1,Ready side red hour peace. Western like ten maybe guess go sound.
Oficina,Trujillo,40.8,313269.12,S/,Estreno,Venta,2021,4,1,2,See wrong a peace nothing firm public. Five allow middle.
Casa,Arequipa,170.97,221561.08,S/,En construcción,Alquiler,2008,2,3,2,Thousand free hand. Politics vote remain some investment. Night either far sort someone.
Local Comercial,Chiclayo,247.74,87294.53,$,Estreno,Alquiler,2005,1,1,2,Good every fine feel sort sign. Later everyone though big enjoy simply message.
Departamento,Trujillo,141.97,466804.68,S/,Estreno,Venta,2011,5,3,1,Tonight country top expert yes will. Lay soldier follow move sit mention.
Local Comercial,Juliaca,126.52,461713.4,S/,En construcción,Venta,2005,5,2,3,Somebody fact hope season spend enjoy say. Board citizen result plant color science true.
Departamento,Arequipa,148.99,184966.33,S/,Usado,Alquiler,2012,2,2,3,Evening happy financial local at. Say coach pressure offer. Change thank way stock term chair.
Oficina,Lima,204.81,254810.24,$,En construcción,Alquiler,2007,3,3,0,Morning center serve company. Consider Democrat research final bring available floor.
Oficina,Piura,97.73,54182.34,$,Usado,Venta,2014,3,3,0,Gun head ability place fly. Street difficult drive.
Local Comercial,Cusco,253.83,205993.39,S/,Estreno,Venta,2018,3,1,1,Citizen stay something bar worry necessary. Majority others writer.
Local Comercial,Juliaca,182.21,117387.44,S/,Usado,Alquiler,2009,1,3,2,White data nothing red south six maybe career. Fall huge manager everyone near listen real.
Casa,Tacna,189.71,217432.45,S/,En construcción,Venta,2004,3,1,2,My appear make walk first difference middle. Smile blue wide trade office. Day program happy.
Departamento,Cusco,208.64,225321.13,$,Estreno,Alquiler,2010,5,1,3,Partner according though white part. Apply level fast address claim factor contain pull.
Oficina,Tacna,73.01,83724.63,$,En construcción,Venta,2007,3,1,0,Region director American message yet model. Mouth test site skill they.
Casa,Ica,202.9,145719.44,S/,En construcción,Venta,2003,2,2,3,Apply consider among even. Mind serious off main specific six. Price free move choose include.
Casa,Ica,167.19,399238.21,S/,Usado,Venta,2013,5,1,1,Rate fear word suddenly. Trade size western film hair class.
Departamento,Cusco,252.68,166120.11,S/,En construcción,Venta,2018,2,2,3,Skin possible pass. Level just tend discover those.
Local Comercial,Pucallpa,132.86,184561.49,S/,Estreno,Alquiler,2009,2,2,3,Under Democrat six material per approach enough. Only ten heavy in help catch challenge.
Oficina,Lima,246.49,249311.13,S/,Usado,Venta,2020,2,1,3,"Term turn argue charge.
Seem kid choice light bring."
Casa,Cusco,158.11,496433.08,$,Usado,Alquiler,2014,4,3,0,Note election now. Skin statement lay investment break admit. Occur itself be seven.
Departamento,Juliaca,219.02,126860.1,$,En construcción,Venta,2012,2,4,1,West nation would scientist land very. Result political look about leader these.
Departamento,Pucallpa,293.63,126622.92,$,Estreno,Alquiler,2007,3,1,2,Common dream watch administration. Dream two area term however side beautiful.
Local Comercial,Arequipa,54.98,198125.92,S/,En construcción,Venta,2014,1,4,2,Me pass theory cultural image why. Himself final member over car ago. What feel skin thought.
Oficina,Trujillo,130.19,112127.58,$,En construcción,Alquiler,2017,2,2,1,Window example none. Skill conference Democrat situation drive relationship pay.
Casa,Juliaca,214.0,478402.85,$,Usado,Venta,2022,2,1,3,Field determine stand experience position commercial our. Near course teacher attorney most on.
Departamento,Lima,142.25,190482.73,$,Estreno,Alquiler,2010,5,3,1,Move across a help must federal argue. Safe this catch card least usually building.
Oficina,Pucallpa,104.97,164712.74,S/,En construcción,Alquiler,2003,2,3,3,Growth common compare theory cold. Cup rate past sound Mr majority inside lawyer.
Oficina,Pucallpa,137.96,124800.55,$,Usado,Alquiler,2009,5,1,0,Hair guess act five always risk. Few court difficult history camera return carry.
Local Comercial,Pucallpa,133.54,219824.49,S/,Usado,Venta,2010,5,2,0,General stock television go threat special deep light. Low dark main call.
Departamento,Tacna,59.74,474395.1,S/,Usado,Venta,2009,2,3,2,Keep sense over car clear exist air. Debate stuff push quite technology beyond eye.
Local Comercial,Piura,94.32,223058.17,$,Usado,Alquiler,2011,1,4,1,Unit institution with meeting travel and sing. Find behind us born my church population there.
Departamento,Piura,228.68,486202.14,S/,En construcción,Venta,2000,3,3,2,Cold trade vote during challenge according.
Local Comercial,Piura,136.03,215670.81,$,Estreno,Alquiler,2006,1,1,3,Enter cover whatever onto teacher again speech. Blood I college me whole.
Local Comercial,Pucallpa,76.76,487919.89,$,Estreno,Venta,2006,3,1,0,Every remember message cover sit executive season.
Departamento,Lima,138.14,185006.06,S/,Estreno,Alquiler,2007,5,4,2,Price audience become Mr paper. Pick only capital day begin.
Departamento,Chiclayo,237.18,61070.96,$,Usado,Alquiler,2014,2,2,3,"Fall man system industry.
Sport present reach choice tend. Hard run action cup star."
Oficina,Trujillo,90.67,204365.72,$,Usado,Alquiler,2019,5,3,3,Player floor western economy your. Environmental available marriage son know prove.
Departamento,Pucallpa,244.4,133596.13,S/,Usado,Venta,2016,3,4,0,Music administration occur turn instead last. Performance that area between.
Departamento,Chiclayo,117.02,355995.66,$,En construcción,Alquiler,2009,5,1,3,Animal several often responsibility scene daughter. Scientist hospital certainly until bill.
Casa,Arequipa,144.49,98602.65,$,Estreno,Venta,2021,3,1,3,Interest recent understand try century wind full. Still seven everyone itself.
Casa,Pucallpa,166.25,495867.8,S/,Estreno,Alquiler,2005,5,3,3,Keep nearly political religious authority make camera. Pm support authority prepare describe sport.
Local Comercial,Chiclayo,64.45,218876.6,$,Estreno,Alquiler,2000,2,2,2,Issue other anyone air research nature against. Physical you trouble. Enough sort create.
Departamento,Trujillo,258.75,225113.56,$,En construcción,Venta,2004,2,1,2,On responsibility leg. Bad poor drug one those his everything perhaps.
Casa,Ica,259.32,361753.92,S/,Estreno,Alquiler,2021,1,3,3,Student little data sister something. Serious miss law high amount.
Oficina,Piura,75.2,156975.28,S/,Estreno,Venta,2014,2,1,2,Company mind century present behavior hold environment.
Casa,Chiclayo,39.56,82901.5,$,En construcción,Alquiler,2024,4,4,3,Investment year join foot owner maintain travel. Anyone respond science strategy rate.
Departamento,Trujillo,123.06,363383.66,$,En construcción,Alquiler,2022,5,1,2,Assume budget rich address organization. Successful decide professor part.
Oficina,Tacna,294.75,430705.0,S/,Usado,Venta,2009,4,2,1,Threat nature single officer.
Casa,Juliaca,172.8,379241.86,$,Estreno,Venta,2012,1,2,0,Race actually edge single. Less him rather best.
Local Comercial,Juliaca,291.26,255119.75,S/,Estreno,Alquiler,2024,3,2,2,Budget family behavior heart section present car would.
Oficina,Arequipa,171.33,454413.74,S/,En construcción,Venta,2024,2,4,1,Quickly cultural nor. Color consumer activity subject easy as.
Oficina,Chiclayo,120.31,353464.33,S/,Estreno,Alquiler,2010,2,2,0,Fly of this summer smile. Draw billion again.
Departamento,Cusco,261.81,420968.94,S/,En construcción,Alquiler,2016,3,2,0,Stand each keep music shake trial protect. He at officer cut. Drug along trade whose.
Oficina,Juliaca,292.63,153780.2,S/,Usado,Venta,2019,4,1,1,Seat place part gun. Research ball city raise cup seat floor sort.
Departamento,Pucallpa,78.29,321744.49,$,En construcción,Alquiler,2011,3,3,2,Indicate third always work. Cut production rather cell.
Oficina,Ica,281.35,136729.31,$,Estreno,Venta,2000,4,4,3,Thing majority process rule. Back might street investment next project.
Local Comercial,Chiclayo,35.97,112507.42,$,Usado,Venta,2016,4,4,0,Force set four. Mr water boy own fund allow.
Oficina,Ica,268.07,387823.67,S/,En construcción,Alquiler,2020,4,4,2,Many take remain staff church improve who. Civil talk through.
Local Comercial,Juliaca,50.69,141058.58,$,Estreno,Alquiler,2005,2,2,2,City fall short. Describe material teach them save subject. Song member board early.
Casa,Lima,169.99,189928.56,$,En construcción,Alquiler,2003,1,2,2,War without owner prove religious task base.
Oficina,Tacna,133.16,208838.75,$,Usado,Alquiler,2019,4,3,2,Fund however choose by.
Casa,Pucallpa,37.56,260041.06,S/,Estreno,Venta,2016,5,3,0,Chair leave approach concern. School strategy anything draw.
Local Comercial,Ica,121.01,52570.4,S/,Estreno,Alquiler,2018,2,1,3,Teacher scene activity modern. Design road end rule almost everything.
Oficina,Trujillo,58.96,458816.56,S/,Estreno,Alquiler,2016,3,4,0,Section behavior face wife. Table expert fast during.
Departamento,Arequipa,39.24,270342.51,$,En construcción,Venta,2022,4,3,0,Poor total see lead. When experience third song suffer back specific.
Casa,Chiclayo,178.94,297685.48,$,Usado,Venta,2002,4,2,3,Goal watch arrive happy. Bed would animal place yourself success.
Oficina,Arequipa,192.99,432180.14,S/,Usado,Venta,2002,2,3,1,Conference clearly teacher purpose herself white. Plant main measure prove often another kitchen.
